19:13:27.125050 IP 138.197.167.253.22 > 198.96.84.226.52967: Flags [P.], seq 364360:364516, ack 181, win 501, length 156
19:13:27.125104 IP 138.197.167.253.22 > 198.96.84.226.52967: Flags [P.], seq 364516:364672, ack 181, win 501, length 156
19:13:27.125159 IP 138.197.167.253.22 > 198.96.84.226.52967: Flags [P.], seq 364672:364828, ack 181, win 501, length 156
19:13:27.125213 IP 138.197.167.253.22 > 198.96.84.226.52967: Flags [P.], seq 364828:364984, ack 181, win 501, length 156
19:13:27.125269 IP 138.197.167.253.22 > 198.96.84.226.52967: Flags [P.], seq 364984:365140, ack 181, win 501, length 156
19:13:27.125323 IP 138.197.167.253.22 > 198.96.84.226.52967: Flags [P.], seq 365140:365296, ack 181, win 501, length 156
19:13:27.125379 IP 138.197.167.253.22 > 198.96.84.226.52967: Flags [P.], seq 365296:365452, ack 181, win 501, length 156
19:13:27.125431 IP 138.197.167.253.22 > 198.96.84.226.52967: Flags [P.], seq 365452:365608, ack 181, win 501, length 156
19:13:27.125485 IP 138.197.167.253.22 > 198.96.84.226.52967: Flags [P.], seq 365608:365764, ack 181, win 501, length 156
19:13:27.125544 IP 138.197.167.253.22 > 198.96.84.226.52967: Flags [P.], seq 365764:365920, ack 181, win 501, length 156
19:13:27.125560 IP 198.96.84.226.52967 > 138.197.167.253.22: Flags [.], ack 362244, win 512, length 0
19:13:27.125632 IP 138.197.167.253.22 > 198.96.84.226.52967: Flags [P.], seq 365920:366180, ack 181, win 501, length 260
19:13:27.125688 IP 138.197.167.253.22 > 198.96.84.226.52967: Flags [P.], seq 366180:366336, ack 181, win 501, length 156
19:13:27.125743 IP 138.197.167.253.22 > 198.96.84.226.52967: Flags [P.], seq 366336:366492, ack 181, win 501, length 156
19:13:27.125797 IP 138.197.167.253.22 > 198.96.84.226.52967: Flags [P.], seq 366492:366648, ack 181, win 501, length 156
19:13:27.125890 IP 198.96.84.226.52967 > 138.197.167.253.22: Flags [.], ack 362556, win 511, length 0
19:13:27.125902 IP 138.197.167.253.22 > 198.96.84.226.52967: Flags [P.], seq 366648:366804, ack 181, win 501, length 156
19:13:27.125971 IP 138.197.167.253.22 > 198.96.84.226.52967: Flags [P.], seq 366804:367064, ack 181, win 501, length 260
19:13:27.126030 IP 138.197.167.253.22 > 198.96.84.226.52967: Flags [P.], seq 367064:367220, ack 181, win 501, length 156
19:13:27.126084 IP 138.197.167.253.22 > 198.96.84.226.52967: Flags [P.], seq 367220:367376, ack 181, win 501, length 156
19:13:27.126141 IP 138.197.167.253.22 > 198.96.84.226.52967: Flags [P.], seq 367376:367532, ack 181, win 501, length 156
19:13:27.126357 IP 138.197.167.253.22 > 198.96.84.226.52967: Flags [P.], seq 367532:367688, ack 181, win 501, length 156
19:13:27.126439 IP 138.197.167.253.22 > 198.96.84.226.52967: Flags [P.], seq 367688:367844, ack 181, win 501, length 156
19:13:27.126498 IP 138.197.167.253.22 > 198.96.84.226.52967: Flags [P.], seq 367844:368000, ack 181, win 501, length 156
19:13:27.126558 IP 138.197.167.253.22 > 198.96.84.226.52967: Flags [P.], seq 368000:368156, ack 181, win 501, length 156
19:13:27.126613 IP 138.197.167.253.22 > 198.96.84.226.52967: Flags [P.], seq 368156:368312, ack 181, win 501, length 156
19:13:27.126669 IP 138.197.167.253.22 > 198.96.84.226.52967: Flags [P.], seq 368312:368468, ack 181, win 501, length 156
19:13:27.126723 IP 138.197.167.253.22 > 198.96.84.226.52967: Flags [P.], seq 368468:368624, ack 181, win 501, length 156
19:13:27.126778 IP 138.197.167.253.22 > 198.96.84.226.52967: Flags [P.], seq 368624:368780, ack 181, win 501, length 156
19:13:27.126834 IP 138.197.167.253.22 > 198.96.84.226.52967: Flags [P.], seq 368780:368936, ack 181, win 501, length 156
19:13:27.129859 IP 198.96.84.226.52967 > 138.197.167.253.22: Flags [.], ack 363128, win 509, length 0
19:13:27.129860 IP 198.96.84.226.52967 > 138.197.167.253.22: Flags [.], ack 364048, win 512, length 0
19:13:27.129860 IP 198.96.84.226.52967 > 138.197.167.253.22: Flags [.], ack 365608, win 512, length 0
19:13:27.129860 IP 198.96.84.226.52967 > 138.197.167.253.22: Flags [.], ack 367376, win 512, length 0
19:13:27.129860 IP 198.96.84.226.52967 > 138.197.167.253.22: Flags [.], ack 368000, win 510, length 0
19:13:27.129860 IP 198.96.84.226.52967 > 138.197.167.253.22: Flags [.], ack 368936, win 512, length 0
19:13:27.129912 IP 138.197.167.253.22 > 198.96.84.226.52967: Flags [P.], seq 368936:369092, ack 181, win 501, length 156
19:13:27.130189 IP 138.197.167.253.22 > 198.96.84.226.52967: Flags [P.], seq 369092:369872, ack 181, win 501, length 780
19:13:27.130324 IP 138.197.167.253.22 > 198.96.84.226.52967: Flags [P.], seq 369872:370028, ack 181, win 501, length 156
19:13:27.130390 IP 138.197.167.253.22 > 198.96.84.226.52967: Flags [P.], seq 370028:370184, ack 181, win 501, length 156
19:13:27.130447 IP 138.197.167.253.22 > 198.96.84.226.52967: Flags [P.], seq 370184:370340, ack 181, win 501, length 156
19:13:27.130504 IP 138.197.167.253.22 > 198.96.84.226.52967: Flags [P.], seq 370340:370496, ack 181, win 501, length 156
19:13:27.130561 IP 138.197.167.253.22 > 198.96.84.226.52967: Flags [P.], seq 370496:370652, ack 181, win 501, length 156
19:13:27.130615 IP 138.197.167.253.22 > 198.96.84.226.52967: Flags [P.], seq 370652:370808, ack 181, win 501, length 156
19:13:27.130672 IP 138.197.167.253.22 > 198.96.84.226.52967: Flags [P.], seq 370808:370964, ack 181, win 501, length 156
19:13:27.130727 IP 138.197.167.253.22 > 198.96.84.226.52967: Flags [P.], seq 370964:371120, ack 181, win 501, length 156
19:13:27.130782 IP 138.197.167.253.22 > 198.96.84.226.52967: Flags [P.], seq 371120:371276, ack 181, win 501, length 156
19:13:27.130838 IP 138.197.167.253.22 > 198.96.84.226.52967: Flags [P.], seq 371276:371432, ack 181, win 501, length 156
19:13:27.130894 IP 138.197.167.253.22 > 198.96.84.226.52967: Flags [P.], seq 371432:371588, ack 181, win 501, length 156
19:13:27.130949 IP 138.197.167.253.22 > 198.96.84.226.52967: Flags [P.], seq 371588:371744, ack 181, win 501, length 156
19:13:27.131004 IP 138.197.167.253.22 > 198.96.84.226.52967: Flags [P.], seq 371744:371900, ack 181, win 501, length 156
19:13:27.131059 IP 138.197.167.253.22 > 198.96.84.226.52967: Flags [P.], seq 371900:372056, ack 181, win 501, length 156
19:13:27.131179 IP 138.197.167.253.22 > 198.96.84.226.52967: Flags [P.], seq 372056:372212, ack 181, win 501, length 156
19:13:27.131249 IP 138.197.167.253.22 > 198.96.84.226.52967: Flags [P.], seq 372212:372368, ack 181, win 501, length 156
19:13:27.131307 IP 138.197.167.253.22 > 198.96.84.226.52967: Flags [P.], seq 372368:372524, ack 181, win 501, length 156
19:13:27.131366 IP 138.197.167.253.22 > 198.96.84.226.52967: Flags [P.], seq 372524:372680, ack 181, win 501, length 156
19:13:27.131423 IP 138.197.167.253.22 > 198.96.84.226.52967: Flags [P.], seq 372680:372836, ack 181, win 501, length 156
19:13:27.131480 IP 138.197.167.253.22 > 198.96.84.226.52967: Flags [P.], seq 372836:372992, ack 181, win 501, length 156
19:13:27.131537 IP 138.197.167.253.22 > 198.96.84.226.52967: Flags [P.], seq 372992:373148, ack 181, win 501, length 156
19:13:27.131593 IP 138.197.167.253.22 > 198.96.84.226.52967: Flags [P.], seq 373148:373304, ack 181, win 501, length 156
19:13:27.131648 IP 138.197.167.253.22 > 198.96.84.226.52967: Flags [P.], seq 373304:373460, ack 181, win 501, length 156
19:13:27.131703 IP 138.197.167.253.22 > 198.96.84.226.52967: Flags [P.], seq 373460:373616, ack 181, win 501, length 156
19:13:27.131758 IP 138.197.167.253.22 > 198.96.84.226.52967: Flags [P.], seq 373616:373772, ack 181, win 501, length 156
19:13:27.131812 IP 138.197.167.253.22 > 198.96.84.226.52967: Flags [P.], seq 373772:373928, ack 181, win 501, length 156
19:13:27.131868 IP 138.197.167.253.22 > 198.96.84.226.52967: Flags [P.], seq 373928:374084, ack 181, win 501, length 156
19:13:27.131925 IP 138.197.167.253.22 > 198.96.84.226.52967: Flags [P.], seq 374084:374240, ack 181, win 501, length 156
19:13:27.131981 IP 138.197.167.253.22 > 198.96.84.226.52967: Flags [P.], seq 374240:374396, ack 181, win 501, length 156
19:13:27.132039 IP 138.197.167.253.22 > 198.96.84.226.52967: Flags [P.], seq 374396:374552, ack 181, win 501, length 156
19:13:27.132264 IP 138.197.167.253.22 > 198.96.84.226.52967: Flags [P.], seq 374552:374708, ack 181, win 501, length 156
19:13:27.132334 IP 138.197.167.253.22 > 198.96.84.226.52967: Flags [P.], seq 374708:374864, ack 181, win 501, length 156
19:13:27.132464 IP 138.197.167.253.22 > 198.96.84.226.52967: Flags [P.], seq 374864:375020, ack 181, win 501, length 156
19:13:27.132529 IP 138.197.167.253.22 > 198.96.84.226.52967: Flags [P.], seq 375020:375176, ack 181, win 501, length 156
19:13:27.132586 IP 198.96.84.226.52967 > 138.197.167.253.22: Flags [.], ack 370496, win 512, length 0
19:13:27.132638 IP 138.197.167.253.22 > 198.96.84.226.52967: Flags [P.], seq 375176:375332, ack 181, win 501, length 156
19:13:27.132691 IP 138.197.167.253.22 > 198.96.84.226.52967: Flags [P.], seq 375332:375472, ack 181, win 501, length 140
19:13:27.132744 IP 138.197.167.253.22 > 198.96.84.226.52967: Flags [P.], seq 375472:375628, ack 181, win 501, length 156
19:13:27.132797 IP 138.197.167.253.22 > 198.96.84.226.52967: Flags [P.], seq 375628:375784, ack 181, win 501, length 156
19:13:27.132850 IP 138.197.167.253.22 > 198.96.84.226.52967: Flags [P.], seq 375784:375940, ack 181, win 501, length 156
19:13:27.132901 IP 138.197.167.253.22 > 198.96.84.226.52967: Flags [P.], seq 375940:376096, ack 181, win 501, length 156
19:13:27.132952 IP 138.197.167.253.22 > 198.96.84.226.52967: Flags [P.], seq 376096:376252, ack 181, win 501, length 156
19:13:27.133022 IP 138.197.167.253.22 > 198.96.84.226.52967: Flags [P.], seq 376252:376408, ack 181, win 501, length 156
19:13:27.133486 IP 198.96.84.226.52967 > 138.197.167.253.22: Flags [.], ack 372212, win 512, length 0
19:13:27.133486 IP 198.96.84.226.52967 > 138.197.167.253.22: Flags [.], ack 373304, win 508, length 0
19:13:27.133510 IP 138.197.167.253.22 > 198.96.84.226.52967: Flags [P.], seq 376408:376720, ack 181, win 501, length 312
19:13:27.133624 IP 138.197.167.253.22 > 198.96.84.226.52967: Flags [P.], seq 376720:377084, ack 181, win 501, length 364
19:13:27.133684 IP 138.197.167.253.22 > 198.96.84.226.52967: Flags [P.], seq 377084:377240, ack 181, win 501, length 156
19:13:27.133735 IP 138.197.167.253.22 > 198.96.84.226.52967: Flags [P.], seq 377240:377396, ack 181, win 501, length 156
19:13:27.133787 IP 138.197.167.253.22 > 198.96.84.226.52967: Flags [P.], seq 377396:377552, ack 181, win 501, length 156
19:13:27.133840 IP 138.197.167.253.22 > 198.96.84.226.52967: Flags [P.], seq 377552:377708, ack 181, win 501, length 156
19:13:27.133913 IP 138.197.167.253.22 > 198.96.84.226.52967: Flags [P.], seq 377708:377864, ack 181, win 501, length 156
19:13:27.133968 IP 138.197.167.253.22 > 198.96.84.226.52967: Flags [P.], seq 377864:378020, ack 181, win 501, length 156
19:13:27.134024 IP 138.197.167.253.22 > 198.96.84.226.52967: Flags [P.], seq 378020:378176, ack 181, win 501, length 156
19:13:27.134076 IP 138.197.167.253.22 > 198.96.84.226.52967: Flags [P.], seq 378176:378332, ack 181, win 501, length 156
19:13:27.134139 IP 138.197.167.253.22 > 198.96.84.226.52967: Flags [P.], seq 378332:378488, ack 181, win 501, length 156
19:13:27.134190 IP 138.197.167.253.22 > 198.96.84.226.52967: Flags [P.], seq 378488:378644, ack 181, win 501, length 156
19:13:27.134241 IP 138.197.167.253.22 > 198.96.84.226.52967: Flags [P.], seq 378644:378800, ack 181, win 501, length 156
19:13:27.134297 IP 138.197.167.253.22 > 198.96.84.226.52967: Flags [P.], seq 378800:378956, ack 181, win 501, length 156
19:13:27.134346 IP 198.96.84.226.52967 > 138.197.167.253.22: Flags [.], ack 374396, win 512, length 0
19:13:27.134346 IP 198.96.84.226.52967 > 138.197.167.253.22: Flags [P.], seq 181:217, ack 374396, win 512, length 36
19:13:27.134346 IP 198.96.84.226.52967 > 138.197.167.253.22: Flags [P.], seq 217:253, ack 374396, win 512, length 36
19:13:27.134430 IP 138.197.167.253.22 > 198.96.84.226.52967: Flags [.], ack 253, win 501, length 0
19:13:27.134475 IP 138.197.167.253.22 > 198.96.84.226.52967: Flags [P.], seq 378956:379456, ack 253, win 501, length 500
^C
2499 packets captured
2500 packets received by filter
0 packets dropped by kernel